original_title,original_language,adult,budget,backdrop_path,homepage,id,imdb_id,overview,popularity,poster_path,release_date,revenue,runtime,status,tagline,title,video,vote_average,vote_count,genre,production_companies,belongs_to_collection,spoken_languages,production_countries,review_count,review_content,keywords,cast_size,crew_size,director
Raoul Wallenberg Tragic Hero or Agent 103?,en,False,0,,,568989,tt4741454,"Raoul Wallenberg born 1912 Stockholm is send to Budapest 1944 July. His job is to save Jewish from Holocaust, his methods are non conventional. January 1945 arrested by Russians at Budapest Siege. Man who saved lives never returns home.",0.6,/4qnIDBT35XVXfFfesHasYyF3pzt.jpg,2018-04-28,0,720.0,Released,,Raoul Wallenberg Tragic Hero or Agent 103?,False,0.0,0,,,,"en,sv,",,0,,,7,1,"Malga Kubiak,"
Divine Being : Essere Divina,it,False,0,,,568923,tt8955024,,0.6,/tDB6mYeq808xdf1emzV0EOyAZpu.jpg,2018-04-20,0,,Released,,Divine Being : Essere Divina,False,0.0,0,,,,,,0,,,0,1,"Luca Pellegrini,"
La vida que te agenciaste,es,False,0,/he9CUNQSKxi22YXOeIyBJVSf8mg.jpg,,568365,tt8400050,25 years ago a group of poets participated in a documentary about an ethylic competition around bars of Buenos Aires.,0.6,/uTXy1Ztaxfs4ItUq46G2u68isfE.jpg,2018-04-12,0,85.0,Released,Argentinian poetry and the passage of time.,This life of yours,False,0.0,0,"Documentary,","AtolladeroCine,En Camino producciones,Intropiamedia,",,"es,","AR,",0,,,5,12,"Mario Varela,"
Take Me Out,en,False,0,,,568279,tt5575364,Not Your Ordinary Day in the Park.,0.6,/sstzKZnoUJ4m1tZE6jM861A7IYR.jpg,2018-04-10,0,83.0,Released,,Take Me Out,False,7.5,2,"Drama,Family,",,,,,0,,,4,1,"Joe Shanks,"
Butterfly,en,False,0,,,568081,,A journey of new life.,0.6,/5LlfQJ9BgDEWtXputTjUbgT1nTV.jpg,2018-04-20,0,19.0,Released,,Butterfly,False,0.0,0,"Music,",,,,,0,,,0,5,"Raz Vahn,"
"Director Z, el vendedor de ilusiones",es,False,0,/jLTvpOuhVjDkVApWsYJY7xtgB1m.jpg,,567774,,A documentary film about cult director José María Zabalza. How he made pictures with very little money and was granted little recognition.,0.6,/owAJPH0WUPn1uCxfdZGMy5bC9C1.jpg,2018-04-20,0,80.0,Released,,"Director Z, el vendedor de ilusiones",False,0.0,0,"Documentary,","esRec,",,"es,","ES,",0,,"filmmaker,director,filmmaking,struggling artist,",0,8,"Oskar Tejedor,"
A Barriga de Mariana,pt,False,0,,,567682,tt8787612,"During a summer vacation, a young couple deals with an unexpected pregnancy.",0.6,,2018-04-27,0,19.0,Released,,Mariana’s Late,False,0.0,0,"Drama,",,,"pt,","PT,",0,,,5,8,"Frederico Mesquita,"
Abgetaucht,de,False,0,/8YHyezndn7F3OAEwNZeeYp8cjWa.jpg,,567631,tt8488970,"A father and his daughter on a typical camping holiday, but something isn't right.",0.6,/3KpC72deGV5FiK5rjJ1bz379Swn.jpg,2018-04-13,0,15.0,Released,,Abgetaucht,False,0.0,0,"Drama,",,,,"DE,",0,,,0,2,"Moritz Boll,"
Lycanimator,en,False,3500,,,567429,tt6316856,"A group of friends go to an abandoned house for a weekend getaway only to stumble across a mad scientist with some monster-making goo. When some of that goo turns one of the group into a hungry, lustful beast - well let's just say it spells trouble.",0.6,/r79NF69FomkswmygaosL5hIefYg.jpg,2018-04-28,0,60.0,Released,Who is afraid of the big slimy wolf?,Lycanimator,False,1.0,1,"Horror,","C Word Productions,Melting Man Films,",,,,0,,,20,5,"Sébastien Godin,"
Tortoise,en,False,0,,,567387,tt7620224,A young man's broken masculinity is exposed by a talking tortoise.,0.6,/yu13unKRHDwpLx2hzGST10rSFt7.jpg,2018-04-14,0,11.0,Released,,Tortoise,False,0.0,0,"Comedy,Drama,",,,,,0,,,2,7,"Stephen Cervantes,"
Ordalie,fr,False,0,,,567113,tt7057250,It's soon 11 when the bell is ringing to Karl's apartment. This is Jean who appears behind the door.,0.6,/7oSJnmM4dtgw4WZq4ApKJtQBU8d.jpg,2018-04-29,0,15.0,Released,,Ordalie,False,0.0,0,,,,"fr,","FR,",0,,,2,1,"Sacha Barbin,"
Лентяйка Василиса,ru,False,0,/aHqerdp0Vgf9lSEmeY8BlVeDdZw.jpg,,566862,,"Once upon a time there was a little girl, Vassilissa. One day Vassilissa, who was walking with her grandmother in the forest, did not want to walk home. But the grandmother had trouble wearing Vasilisa ... What to do? Make quirks and then it will work? Of course it will work but not quite as Vasilisa thought ...",0.6,/bP8lHDDXgRPnCiw855A6gQwVAPu.jpg,2018-04-22,0,13.0,Released,,Vasilisa The Lazy,False,0.0,0,"Animation,","Soyuzmultfilm,",,"ru,","RU,",0,,,5,6,"Marina Karpova,"
Riches,en,False,2000,,,566496,tt8164736,Riches is a documentary film that explores the Christian faith in two different cultures. It follows a British Christian mission team on their trip to Zambia in 2016 and examines the ways in which cultural and social/economic background might impact one's faith.,0.6,/74Cnzdr5gBdRIr4Ef6XOesw2zXb.jpg,2018-04-14,0,38.0,Released,Faith demands cost!,Riches,False,0.0,0,"Documentary,","Lomax Pictures,",,,"GB,",0,,"faith-based,",9,5,"Bryan Lomax,"
หลวงพี่แจ๊ส 5G,th,False,0,/zC0rMJJSJZISqNeuBjzC87ARxPo.jpg,,566242,,Luang Pee Jazz was once again called to look after the temple in Bangkok.,0.6,/bFECkekjyKCBh0KUnCgHHsXJEeB.jpg,2018-04-05,0,114.0,Released,,Joking Jazz 5G,False,0.0,0,"Comedy,",,,,,0,,,5,1,"Poj Arnon,"
هت تریک,fa,False,0,/wYNZrA9ExWlG7Y29m4tNMLWYM25.jpg,,566164,tt8116612,"Four friends run over something after a party in this psychological thriller set in Iran of the empty lives of the middle class when they get together in groups, emotional explosions start happening along moral fault lines.",0.948,/7KSj9tZFsCb6T190HhlcIcIL6L7.jpg,2018-04-20,0,92.0,Released,,Hattrick,False,5.7,3,"Drama,Thriller,",,,"fa,",,0,,,5,2,"Ramtin Lavafipour,"
A Prism of Gentle Waves,en,False,0,/lMnt8cwra5o3Bqfp7TJD6Ar18ax.jpg,,565559,,A short experimental film about light.,0.6,/4cQV8I2dvh5r45XsPoe03eHhXqI.jpg,2018-04-27,0,2.0,Released,Our eyes are the prisms in which cinema's truths are uncovered.,A Prism of Gentle Waves,False,0.0,0,,,,,,0,,,0,2,"Chad Flaska,"
А как наши космонавты,ru,False,0,/1FBlNpqcegTrT1uCEnFGkxBJNDQ.jpg,,564900,,"At the base of the film is the folk song on a traditional theme of the Verkhniaia Pokrovka village in the Belgorod region. After saying goodbye to their loved ones, three cosmonauts jump into the cosmos. Expect them discoveries in an unknown space and not yet conquered by the man.",0.6,/eRc17pInXOE2y1q4arbXkc4fIYH.jpg,2018-04-25,0,7.0,Released,,And How Are Our Cosmonauts,False,0.0,0,"Animation,","Soyuzmultfilm,",,"ru,","RU,",0,,,0,6,"Galina Golubeva,"
Transfert,it,False,0,/h51MCmBrNIsGa1lfKYFsXJ8YYoT.jpg,,563953,tt5070240,,0.6,/pv18zmwuA4IihEsWYrTNeG3OXlg.jpg,2018-04-12,0,0.0,Released,,Transfert,False,7.5,4,"Drama,Thriller,",,,,,0,,,5,1,"Massimiliano Russo,"
Não é só Isso,pt,False,0,,,563952,,,0.6,/6q4s3uM0dy8gJjzq5mK5dXYxPdQ.jpg,2018-04-30,0,,Released,,Não é só Isso,False,0.0,0,,,,,,0,,,0,1,"Yasmin Rocha,"
RPW: Live In New Orleans,en,False,0,,https://rpwondemand.pivotshare.com/media/live-in-new-orleans/73981,563947,,"The Sugar Mill played host to “more than a show” as the face of Rev Pro changed in New Orleans.  We’re at WrestleCon, and an extremely packed venue too, with live reports of the venue having to add extra seats just to get folks to stop standing in the aisles! Andy Quildan is doing double-duty on commentary and ring announcing, joined by Joe Dombrowski.",0.6,/wp3AAJzzObMq3j1m05NKfH3ZHh3.jpg,2018-04-06,0,124.0,Released,,RPW: Live In New Orleans,False,0.0,0,,"Revolution Pro Wrestling,",,"en,","US,",0,,,0,0,"Yasmin Rocha,"
Завтра,ru,False,0,/mypF2ZofHZljLYfes9kNTQrxTiC.jpg,,563852,tt8393260,"People came to the rally. Why are they here, what do they want to change and why do they leave so early? In a role of themselves - young and elderly citizens of Yekaterinburg, Russia.",0.6,/wLNipgkupe7Cb9kX7PBlioiOe94.jpg,2018-04-22,0,5.0,Released,,Tomorrow,False,0.0,0,"Documentary,Animation,",,,"ru,","DE,RU,",0,,,0,8,"Mariya Sedyaeva,"
Solidarity Across Borders,en,False,0,,,563820,,"After Syrian refugees fleeing the war settle in Georges’ community, he and his union work to ensure they all have access to safe public drinking water and sanitation.",0.6,/99dREYs8PCDNLK0Vm0V3kiEk9Qj.jpg,2018-04-17,0,7.0,Released,,Solidarity Across Borders,False,0.0,0,"Documentary,",,,,"FR,LB,",0,,,0,1,"Leo Hyde,"
The Happiest Guy in the World,en,False,0,,,563142,tt8000148,Mario Salcedo took his first cruise almost twenty years ago-and never stopped.,0.6,/pToFRVFFtxKgOFmjlN9pqSUlZv5.jpg,2018-04-26,0,11.0,Released,,The Happiest Guy in the World,False,0.0,0,,,,"en,",,0,,,0,1,"Lance Oppenheim,"
As-Sekka,ar,False,0,,,563043,tt9643450,"The Tunisian National Railway Company is one of the country’s oldest and wealthiest state-run companies. Five employees reveal a darker side of life on the railways. On Tunisia’s most infamous railway line, workers rack up many hours of overtime and the worn-out rolling stock is unreliable. As a consequence, the safety of railway workers and passengers is put at risk. But how can life improve for these Tunisians if they have neither the opportunity nor the freedom to report what’s going on?  This uncompromising view behind the scenes of one of the most important Tunisian companies reveals that much change is needed to bring about a fair, equal and safe society. The candid stories of engineers, technicians and conductors are accompanied by their own footage of everyday life on the railways. Hours of delays, narrowly avoided accidents, broken-down locomotives and fights about signaling have become the norm, and anyone who criticizes faces serious consequences.",0.6,/zrngqcrdiaBQBa6CLtkVmnl7CE.jpg,2018-04-13,0,73.0,Released,,Railway Men,False,6.5,2,"Documentary,",,,"ar,","FR,QA,TN,",0,,,0,1,"Erige Sehiri,"
暑假最後一天,zh,False,0,,,562946,tt8581024,,0.6,,2018-04-28,0,4.0,Released,,The Last Day of Summer,False,0.0,0,"Animation,",,,,,0,,,0,3,"CHEN Tzu Ying,"
青春后驱动,zh,False,0,,,562452,,,0.6,/fK5NA9NbCeAN1xHeaJIjaaUYG9N.jpg,2018-04-13,0,,Released,,青春后驱动,False,0.0,0,,,,,,0,,,0,0,"CHEN Tzu Ying,"
Black ANZAC,en,False,0,,,561994,tt8378512,A Documentary about Australian Artist Hego's journey to tell an under-told story of Australian Indigenous WW1 history through a mural in the Indigenous heart of Sydney.,0.6,/xtpBahxyvoXsKJZSm05JdTmzxeV.jpg,2018-04-22,0,75.0,Released,,Black ANZAC,False,0.0,0,"Documentary,",,,,,0,,,0,3,"Tim Anastasi,"
Ashes to Ashes,en,False,0,,,561897,,An ex-cop is thrust back into the world that killed her girlfriend when she agrees to take a brokenhearted young man's case.,0.6,/4qgbJwM5eQ6oXOJCIKcQcu7x50l.jpg,2018-04-09,0,78.0,Released,,Ashes to Ashes,False,0.0,0,,,,,,0,,,3,4,"Daniel Tucker,"
Chief - Keishichou IR Bunsekishitsu,ja,False,0,,,561881,,"ogane Takichi, the CEO of a construction company, is shot dead in the street in Nishi Shinjuku in Tokyo. The only eyewitness, Odagiri Naoto, refuses to cooperate with the police for some reason. Fukamachi Kotaro, a senior member of the IR Analysis Office, is ordered by Nitta Yukihiko, the head of the First Investigative Division, to handle Odagiri. The newly established office was set up on the pretext of tracking and monitoring suspects and witnesses to advance investigations by using the many surveillance cameras and GPS trackers installed in Tokyo.",1.108,,2018-04-15,0,0.0,Released,,Chief - Keishichou IR Bunsekishitsu,False,0.0,0,,"TV Asahi,Toei Company,",,"ja,","JP,",0,,,3,7,"Seiji Izumi,"
La Vie sur Mars,fr,False,0,/zPnRu06AkotXVxkrK59LPpBpbcq.jpg,,561311,,,0.6,/LGuuJhFEJlJdqLYHpdmpthyzR0.jpg,2018-04-10,0,17.0,Released,,La Vie sur Mars,False,0.0,0,"Drama,Fantasy,Science Fiction,","Les Fées Productions,",,"fr,","FR,",0,,"adolescence,ufo,grief,coming of age,teenage girl,grieving,woman director,deuil,short,",3,4,"Marie Léa Regales,"
Kandidat 235,sl,False,0,,,561276,tt9584894,"Allen Murphy has an interview for a new job in a company he says he knows next to nothing about. After it turns out that the company knows his entire history and all his secrets, Allen is faced with a fact.",0.6,/gGIr8BKdCprpWMttpO58oM0i7j8.jpg,2018-04-16,0,7.0,Released,,Candidate 235,False,0.0,0,"Drama,","Anamorphic Movies,",,"sl,","SI,",0,,,5,6,"Rok Mlinar,"
Homeless: The Soundtrack,en,False,0,,,561220,tt7616776,"After being taken away from her parents as a baby by the state and given up for adoption, musician ""Cami"" Jenni Alpert went searching for her birth father. She finally finds him: homeless, toothless, addicted. And a musician, just like her.",0.6,/2ICeojgkS8hFUhDoJJV2ivFrtyQ.jpg,2018-04-18,0,27.0,Released,,Homeless: The Soundtrack,False,0.0,0,,,,,,0,,,0,1,"Irene Taylor Brodsky,"
Sookee - Von Seepferdchen und Schränken,en,False,0,/qZ4l1Pe3Yt7t7qUMP2rdRYUCT68.jpg,https://www.kerstinpolte.com/sookee,561037,,"„Sookee - Von Seepferdchen und Schränken“ is an intimate portrait of Sookee, a queer-feminist rapper and activist, who has been fighting sexism, homophobia and racism in German hip hop culture.",0.6,/zVuue3MlkIqKKy9pkQSWeKb96xy.jpg,2018-04-28,0,34.0,Released,On Seahorses and Cupboards,Sookee,False,0.0,0,"Documentary,","Serienwerk,",,"de,","DE,",0,,"germany,hip-hop,feminism,",1,8,"Kerstin Polte,"
Issa Doumbia - Première consultation,fr,False,0,/i3faNVYpPBFN5pz2W0eTU1KHjEz.jpg,,560548,,,0.6,/2I5r2B7U7jlWX4nSdC0ullQ8Mf7.jpg,2018-04-09,0,,Released,,Issa Doumbia - Première consultation,False,7.5,2,"Comedy,","AW Films,",,"fr,","FR,",0,,"stand-up comedy,",1,1,"Julien Bloch,"
The Good Samaritans,en,False,0,,,560477,tt7679304,"Romania, 1784. Young Elena finds herself stranded alone in a dark, secluded wood. When she is approached by two thieves, Elena's true guise comes to light.",0.6,/huLgI5EWoEUIOcqygN94dSq3YYN.jpg,2018-04-20,0,,Released,,The Good Samaritans,False,0.0,0,,,,,,0,,,3,1,"Christopher Goodman,"
Unknown Distance,en,False,0,,,560443,tt8272380,"After five tours and serving ten years as a Marine Sniper, Sgt. Douglas Brown, takes us on an emotional eight month journey across America, engaging with fellow servicemen who were once a part of a highly trained military team with a specific skill set now rendered useless. The story unfolds when Douglas and an Afghan Interpreter, who served with him in Afghanistan, reveal the story that bonded them for life. Recalling those horrific memories trigger Doug's existing PTSD (Post Traumatic Stress Disorder) that continues to corrode his personal relationships, and has led to his erratic, inappropriate and self damaging behavior.",0.6,/oCGWaUu8tlC4gjU8wFaz05BXiI3.jpg,2018-04-04,0,73.0,Released,,Unknown Distance,False,0.0,0,"Documentary,",,,,,0,,,0,1,"Gordon Clark,"
There Are No Dividends,en,False,0,,,560374,tt8265462,"Darren Hobbs, an entrepreneur, sneaks into a hotel conference room to conduct a careers day. Under the banner of his company: Unique Automation Consultants, he's searching for an engineer to help him complete his prototype, a device that enables warehouse owners to make their workforce, in Darren's words, semi-autonomous. Darren wants manual workers to be able to compete with the robots in the forthcoming automation revolution. Enter Phil Mathews, a hobbyist technology buff, trying to make a change in his career. This could be the start he needs, the job of his dreams. Things look promising; he's enamoured with Darren's pitch and lucrative job offer; until Darren unveils Eazy Guidance.",0.6,/dFuwe6vKapMahw9jg6DCLIA4C1S.jpg,2018-04-01,0,9.0,Released,,There Are No Dividends,False,0.0,0,,,,,,0,,,4,1,"Joe Haughey,"
Seattle,es,False,0,,,560271,tt8238064,"Seattle is a love story between Iván, a pilot, and Amanda, a stewardess, through their meetings in hotels around the world.",0.6,/xzOpdTYpU9hRqo7EPtNOJCgFRDR.jpg,2018-04-13,0,19.0,Released,,Seattle,False,0.0,0,"Romance,Drama,","Solita Films,",,"es,","ES,",0,,"stewardess,love affair,airplane pilot,",6,5,"Marta Aledo,"
Nijinsky,en,False,0,,,559995,,"Nijinsky is the title of this choreographic approach to a dance phenomenon that has been part of Neumeiers life ever since the beginning of his career. During his approximately ten years as a dancer, Vaslav Nijinsky (1889-1950) set a new standard both technically and expressively, while in his choreographic work he pointed the way towards modern dance. All three aspects - the dancer, the choreographer and the person Nijinsky - form the starting point for John Neumeiers latest creation. Neumeier, who as early as 1979 presented a short ballet Vaslav, is regarded as one of the leading Nijinsky experts worldwide.",0.6,/a9GCxmXgvwKi51FbkV4IDEvFiAw.jpg,2018-04-13,0,,Released,,Nijinsky,False,0.0,0,,,,,,0,,,3,1,"Marta Aledo,"
Meeboon being tucked in bed,en,False,0,/dmH6DvGnLCcbmuf6GYrrcNxkdhu.jpg,,559811,,Meeboon is gently laid in her bed and given her beloved plush then lovingly covered with her comfy blanket. The scene is punctuated by a soothing piano melody.,0.6,/fi0BxJiG20gIzvYQuUPUHxl9RCK.jpg,2018-04-05,0,1.0,Released,Probably the most wholesome video on the Internet right now.,Meeboon being tucked in bed,False,7.0,1,"Documentary,",,,"xx,","TH,",0,,,0,0,"Marta Aledo,"
Das blinde Auge,de,False,0,,,559743,,,0.6,/5ztuqQQ3JkQ9ZduLoDFGyrs99f4.jpg,2018-04-10,0,,Released,,Das blinde Auge,False,0.0,0,"Documentary,","Filmpiratinnen und Filmpiraten e.V.,",,,,0,,,0,2,"Jan Smendek,"
여동생 커플 훔쳐보기,ko,False,0,/3HmBgipVOyve4ibov142S92IkFS.jpg,,559630,,A sexual love film depicting the sexual intercourse of a man working at a host bar with two sisters.,0.888,/1hh6z7Q6q3IsFUhEkEBtIoR753L.jpg,2018-04-19,0,70.0,Released,,Sister Couple Peeking,False,3.0,1,"Drama,Romance,",,,"ko,",,0,,,4,1,"Wang Ji-bang,"
Eine eiserne Kassette,de,False,0,,,559341,,"Following the traces of Jürgenssen’s path through the final years of World War II (from Hungary to Italy, and later denazification in Upper Austria, where he got married), Olger visits sites and speaks to witnesses from the period when Olaf Jürgenssen was part of the German war crimes, even if his photos seem to suggest that he was there in all innocence. In a video interview before his death his grandfather remains vague and deflects questions. Nils Olger’s pointed conclusion from his somber and calm film about history, memory and denialism: “What will I remember of my grandfather? Negatives.” (Bert Rebhandl)",0.6,,2018-04-11,0,102.0,Released,,Eine eiserne Kassette,False,0.0,0,,,,,,0,,,0,1,"Nils Olger,"
Waco Inferno: The Untold Story,en,False,0,/8EpO4W0SsBAm5QNlgDnApZurMdM.jpg,,558753,tt8302592,"Documentary charting the rise of David Koresh, the 51-day siege at the Branch Davidian compound and the tragic conclusion to that stand-off. Featuring testimony from five of the 'true believers'.",1.4,/tQ6F1TeKSlk2cp5yo9RYwk4sdDG.jpg,2018-04-16,0,46.0,Released,,Waco Inferno: The Untold Story,False,0.0,0,"Documentary,","ITN Productions,Channel 5 Broadcasting,",,"en,","GB,",0,,,2,0,"Nils Olger,"
Truffel,nl,False,0,,,558513,tt6659198,,0.6,/daTZhKSmWvQ3lKcCsJXcGy4io6s.jpg,2018-04-22,0,,Released,,Truffel,False,0.0,0,,,,"nl,",,0,,,6,1,"Rinus Morsink,"
Hur det känns att vara bakis,sv,False,0,/6PEpK5pf46pfbBBnC4nFncYcsfe.jpg,,557813,tt8198768,"A man wakes up at a clinic specialized in malignant hangovers. The doctor prescribes 600 ml of ice cream and two action comedies, but also shares some news, which doesn't make him feel any better.",0.6,/mlceLst7l7Pa5RX61oErCYXCOSN.jpg,2018-04-26,0,10.0,Released,,How It Feels to Be Hungover,False,8.0,1,"Comedy,","Lyster,",,"sv,","SE,",0,,"hangover,short,",9,9,"Viktor Hertz,"
Delenda,en,False,0,/1Ibz6tVphlg9e2GouTJfN361ovM.jpg,http://www.delendamovie.com,557615,tt6966316,"In the wake of a terrorist attack, a group of young people in New York seek to capitalize on the hysteria in a variety of morally dubious ways.",0.6,/mywxinpDi4nAjqLN2Se3jBodiOH.jpg,2018-04-19,0,107.0,Released,Drugs! Teens! ISIS!,Delenda,False,10.0,1,"Comedy,Drama,","Cows in a Field Productions, Inc.,Industrial Motion Pictures,",,,"US,",0,,"journalism,media,satire,terrorism,teenager,drugs,brooklyn, new york city,delenda,",10,7,"Ralph Moffettone,"
Better Angels,en,False,0,,,557612,tt7579694,"An examination of the complex and turbulent relationship between the world’s two great superpowers, China and America.",0.6,/qEjDOIEEaCACocq0HDEnJtpcNwK.jpg,2018-04-27,0,92.0,Released,,Better Angels,False,0.0,0,"Documentary,",,,,,0,,,0,1,"Malcolm Clarke,"
Коля как зеркало русской революции,ru,False,0,/cFt0JLuCbJm5B2xKkmh9M5cy1QL.jpg,https://artdoc.media/en/movie/kolya_kak_zerkalo_rus_2018_51/,556851,tt8223300,"A simple journey from point A to point B turns into an equation with a lot of unknowns, if you are 20 years old and you are Kolya.",0.6,/nhux44Yc0VZ3wiyXioTelYVgdSO.jpg,2018-04-25,0,51.0,Released,,Kolya as the Mirror of the Russian Revolution,False,0.0,0,"Documentary,","M. Razbezhkina and M. Ugarov Academy,",,"ru,","BY,RU,",0,,,0,5,"Alexandr Zubovlenko,"
Meu Nome é Daniel,pt,False,0,,,555606,tt10009602,"In this disarming and personal documentary, Gonçalves explores precisely what it is that is wrong with him. His physical disability is obvious, but doctors have never managed to provide a diagnosis. As he undergoes a series of tests, he paints a picture of his life today and looks back over his past, assisted by a vast collection of VHS videos, for which he sometimes provides commentary to explain the context.",0.6,/94fAGG7yTs1AFUBJVBYtdRjUoiK.jpg,2018-04-25,0,83.0,Released,,My Name Is Daniel,False,5.7,3,,,,,,1,"‘My Name is Daniel’ offers an insightful look into living life with a physical disability, but its structure could use a little more work.
- Chris dos Santos

Read Chris' full article...
https://www.maketheswitch.com.au/article/review-my-name-is-daniel-a-step-forward-for-disability-representation

Head to https://www.maketheswitch.com.au/sff for more Sydney Film Festival reviews.,",,0,1,"Daniel Gonçalves,"
Den,ru,False,0,,,554869,,,0.6,/bjEidGbD78N6TEzGxUeVEjhRA8h.jpg,2018-04-01,0,,Released,,Den,False,4.0,1,"Drama,Thriller,",,,"ru,","RU,",0,,"short,",3,5,"Aleksey Vovk,"
Travelers,fr,False,0,,,554379,tt9297856,A fifteen-year-old child and his dog Spirale travel with a group of travelers. Winter approaches and life for the group and in the fields becomes more difficult. Either you adapt or have to leave.,0.6,/bS72pazCh1Q46mZ2yyUMji5krSs.jpg,2018-04-14,0,24.0,Released,,Travelers,False,0.0,0,"Drama,",,,"fr,","FR,",0,,,3,3,"Gabrielle Culand,"
Of Dust and Bones,en,False,0,,http://www.ofdustandbones.com/,554351,tt4973322,A woman lives alone in the desert surrounded by memories and ghosts. An uninvited man arrives with a secret agenda. What unfolds is a meditation on grief and how we live meaningfully in a world of unthinkable violence.,0.6,/4jouqdwo1cCiSxVDIFSnt8AdMA8.jpg,2018-04-07,0,99.0,Released,,Of Dust and Bones,False,0.0,0,"Drama,","Rebel Heart Film,",,,,0,,,3,9,"Diane Bell,"
Die Natur des Menschen,en,False,0,,,554209,,"In the video work The Nature of Human, the terms of the human and the lie are treated philosophically via a read text. Definitions connect and question things. In addition hypnotically rotating orchids.",0.6,/tjTkdkJGgx2mpgQbjSulWqbxohI.jpg,2018-04-22,0,7.0,Released,,The Nature of Human,False,0.0,0,,,,"de,",,0,,,0,1,"Charlotte Hock,"
"Navajeros, censores y nuevos realizadores",es,False,0,/xeYBDIwWTm5VT5PBsGWVvMqnZ9V.jpg,,553797,,,0.6,/sBIkDt3yzmHDF1oCFpqbzKPuQMy.jpg,2018-04-15,0,,Released,,"Navajeros, censores y nuevos realizadores",False,7.0,1,"Documentary,History,Crime,","Rafatal PC,SchoolTraining,",,"es,","ES,",0,,"noir,cine quinqui,spanish transition,filmmaking documentary,",20,6,"Rafael R. Rafatal,"
Elif Caglar Live On Akustikhane,tr,False,0,/97VhCUfN27cvyygQhCi5F1EVBPi.jpg,,553523,,Elif Caglar live jazz at the Akustikhane studios.,0.6,/d6oYrE6uwwtQ50OoJDCJUOxyYuF.jpg,2018-04-12,0,51.0,Released,,Elif Caglar Live On Akustikhane,False,0.0,0,"Music,",,,"tr,","TR,",0,,,0,0,"Rafael R. Rafatal,"
The Cage,en,False,0,,,553500,tt7387292,"After being framed in a murder, Nick returns to his troubled hometown Exalon, where he begins an affair with a young man working at a family restaurant.",0.6,/e4shwzjsChOij0dvfwHbDNSiUdD.jpg,2018-04-19,0,68.0,Released,,The Cage,False,0.0,0,,"Spektakulativ,",,"en,","DE,KR,TW,US,",0,,,6,1,"Lior Shamriz,"
Legion of Doom,en,False,0,/tL5CpV4C3sK11H8iDogG4m2Ce28.jpg,,553429,tt3343750,A loose mix of friends freeload through film school and beyond.,0.6,/bgafPbeawU7ttHCqBXXRXL5Ku08.jpg,2018-04-09,0,120.0,Released,(Not the episode of Team Knight Rider),Legion of Doom,False,0.0,0,"Drama,Comedy,","FIA Films,",,"en,","CA,",0,,"college,coming of age,drug trip,break-up,post college,film school,acid trip,",5,10,"Gerry Galli,"
Looking for Déni,fr,False,0,/gN1clh0hdGn0GH3euUZvXygKR2q.jpg,https://artdoc.media/en/movie/looking_for_d%C3%A9ni_2018_19/,553306,tt7551176,"Déni is trying to find himself. His soul-searching takes him on the traces of his childhood, in the snowy landscapes of Kazakhstan. In an apartment decorated with thick drapes, he encounters his Chechen family and his patriarchal culture. At the mosque, or in the boxing gym, he discovers the closeness of the men of his “clan”. They are all virile and settled in their lives. He is struggling to find his place.",0.6,/98tnH21T8t6YU6YnBf5dP9iejAs.jpg,2018-04-16,0,19.0,Released,,Looking for Deni,False,0.0,0,"Documentary,","LUCA School of Arts,",,"ce,ru,","BE,KZ,RU,",0,,,1,4,"Déni Oumar Pitsaev,"
