original_title,original_language,adult,budget,backdrop_path,homepage,id,imdb_id,overview,popularity,poster_path,release_date,revenue,runtime,status,tagline,title,video,vote_average,vote_count,genre,production_companies,belongs_to_collection,spoken_languages,production_countries,review_count,review_content,keywords,cast_size,crew_size,director
Tu mi nascondi qualcosa,it,False,0,/yKulUZKSZcZS2c3QjnBKCIo4zWX.jpg,,512968,tt7325902,,3.701,/bdeHLn9j0OGzIodUudxyJjxHeXM.jpg,2018-04-25,0,0.0,Released,,Tu mi nascondi qualcosa,False,5.3,57,,,,,"IT,",0,,,18,7,"Giuseppe Lo Console,"
Dukun,ms,False,0,/2jpTB89Ydj0mQp9vBTYL6v1JoOt.jpg,,450541,tt0862930,"In a case that had the nation riveted and human rights organizations the world over up in arms due to the death sentence handed out to the accused, comes a tale about the lure of riches, power, eternal youth, beauty and the blood one must spill to achieve this.",3.137,/yny0E5DaepPQAluPSXj4nsCEW6l.jpg,2018-04-05,0,108.0,Released,I Will Never Die,Dukun,False,7.0,6,"Thriller,Horror,","Astro Shaw,",,"ms,","MY,",0,,"black magic,malaysia,",9,6,"Dain Said,"
The Second,en,False,0,/bGZZ1xjLrp2ra7AJTUCaXwhdCD.jpg,https://www.senseandcentsability.com/the-second,519834,tt5636922,"The persona of a celebrated author is threatened when her best friend and muse reveals the dark secret behind her first novel's provenance, igniting an incendiary tale of sex, lies and betrayal.",2.288,/3Jl1r2zHvy7bkXdXne3QN9a6l8Y.jpg,2018-04-22,0,94.0,Released,,The Second,False,6.4,10,"Drama,Thriller,","Sense & Centsability,Screen Queensland,Second Films,",,"en,","AU,",0,,"psychological thriller,",16,23,"Mairi Cameron,"
Armenian Haunting,en,False,30,/9J5HAg1jTl8bBk5XtBJJkYwxCCy.jpg,,533137,tt7445552,An Armenian-American journalist turns into an unwilling ghost hunter while researching the sudden deaths in her family and their connection to a paranormal mystery.,3.11,/kzhko7n2CmNcKGr85jNoY1RxYXN.jpg,2018-04-24,0,78.0,Released,Denial is a Hundred Year Old Curse.,Armenian Haunting,False,8.0,3,"Horror,",,,,,0,,,1,0,"Mairi Cameron,"
The Time Capsule,en,False,0,,http://pixltv.com/the-time-capsule-premieres-saturday-april-7th/,517055,tt5886380,"After ten years, a group of high school friends reunite at their alma mater to dig up their old time capsule. When they open it, they make a pact to recreate all their best high school moments. Little do they realize the power of the time capsule to heal broken hearts and inspire newfound relationships.",3.411,/ySxtdwzbH2FPJ4YPN9bmHcQy7fX.jpg,2018-04-07,0,86.0,Released,,The Time Capsule,False,6.0,6,"Romance,TV Movie,",,,"en,","US,",0,,,6,6,"Bradford May,"
Edge of Isolation,en,False,0,/xqVB0qEuNrknlsYQ08sho8BCXxZ.jpg,,523353,tt6384998,"Stranded deep in the woods, a young married couple is taken in by an isolationist family, one that lives off the blood and plunder from lost hikers, and they want the couple to stay for the rest of their lives.",3.06,/sG6kNycJzAjQ16LVyZd8wsEAFOC.jpg,2018-04-20,0,89.0,Released,Fear The Road Less Traveled,Edge of Isolation,False,4.0,2,"Horror,Drama,Thriller,","Violet State Productions,",,"en,","US,",0,,,7,8,"Jeff Houkal,"
A Dangerous Date,en,False,2500000,/hSiYDAhNbc3gdmX5SUyZWFw4NB5.jpg,https://www.mylifetime.com/movies/a-dangerous-date,521224,tt4117338,"Julie introduces her single father, Peter, to the world of online dating. When Peter meets Alexis, it's love at first sight. But as Julie and Alexis get to know each other, she begins to learn that Alexis might not be what she seems.",3.057,/qyQNZuCNMq6Vgs5Oq7GRZWyvJaq.jpg,2018-04-14,0,82.0,Released,,A Dangerous Date,False,6.5,2,"Thriller,TV Movie,","Dawn's Light,",,"en,","US,",0,,,15,20,"Jared Cohn,"
Nothing Is Truer than Truth,en,False,0,,http://www.controversyfilms.com/production/nothing-is-truer-than-truth/,521488,tt4459424,"NOTHING IS TRUER THAN TRUTH is a feature length documentary about Edward de Vere, Seventeenth Earl of Oxford, A-list party boy on the continental circuit, who spent a year and a half in Venice and traveling in Europe, learning about commedia dell'arte and collecting the experiences that would become the Shakespeare plays. Shot in Venice, Verona, Mantua, Padua, and Brenta, the film ventures to actual sites De Vere visited in 1575-76, including the settings for THE MERCHANT OF VENICE, OTHELLO, ROMEO & JULIET, and TWO GENTLEMEN OF VERONA. The film features renowned Shakespeare scholars, actors, and directors, including Sir Derek Jacobi, Mark Rylance, Tina Packer, and Diane Paulus, and argues that De Vere's bisexuality is the reason for the pseudonym Shake-speare.",3.01,/zbuGYuD59d258ifebEmqicBB3Qr.jpg,2018-04-29,0,75.0,Released,,Nothing Is Truer than Truth,False,0.0,0,"Documentary,History,",,,"en,","IT,GB,US,",0,,,5,22,"Cheryl Eagan-Donovan,"
The Incantation,en,False,0,/dIsO11ru13CLNMnGoL3gEvBV84Y.jpg,,537542,tt5361596,"A young American girl has a chance of a lifetime to visit her ancestors castle in the south of France, only to find that her family is hiding deep, dark secrets about their nefarious past, far away from prying eyes.",2.954,/3W7DmKE4yix6lQUDVpN44SIFjap.jpg,2018-04-27,0,98.0,Released,DO NOT DENY YOUR TRUE NATURE.,The Incantation,False,4.9,8,"Adventure,Fantasy,Horror,Mystery,Thriller,","Blue Falcon Productions,",,"en,",,0,,,4,5,"Jude S. Walko,"
The Queen's Green Planet,en,False,0,,,519864,tt8245604,"Featuring a unique conversation between The Queen and Sir David Attenborough as they walked in the garden at Buckingham Palace last summer, a landmark documentary will explore the ambition of a remarkable new initiative - a vast network of native forests across Britain and the Commonwealth, protected forever in The Queen's name.",2.953,/dBXQKFHBJKlU1aTzeRjZeBujEdJ.jpg,2018-04-16,0,47.0,Released,,The Queen's Green Planet,False,6.3,3,"Documentary,TV Movie,","ITN Productions,",,"en,","GB,",0,,,7,9,"Jane Treays,"
Impact Event,en,False,0,,,690557,tt6945500,A slow burn into insanity as a small band of survivors find themselves spending a post-meteoric apocalypse in a fun house converted into a bomb shelter.,2.942,/2vjo2sCXVxMLzNXKXNrZiOfb047.jpg,2018-04-07,0,102.0,Released,,Impact Event,False,0.0,0,"Science Fiction,",,,"en,","US,",0,,,6,1,"B. Luciano Barsuglia,"
The More You Ignore Me,en,False,0,/fvuRN6tgNsFR7p6P8i7WhvuJUU6.jpg,,484579,tt2838568,"Based on Jo Brand's critically acclaimed novel of the same name, The More You Ignore Me is a warm, comedy drama focusing on the life of an unconventional family in 1980s rural England. The film focuses on Gina, a young mother, whose efforts to be a loving mother and wife are undermined by her declining mental health. Things deteriorate when she develops an obsession with the local weatherman, which leads to an admission to the nearby psychiatric hospital. Over the years, as she grows up, her daughter Alice struggles to relate to her heavily medicated mum, and causes chaos when she comes up with a plan to reconnect with her, which divides the family forever and leads to a moving climax. Set to the songs of The Smiths, The More You Ignore Me provides a sometimes stark, yet comical insight into life within this quirky household, whilst addressing mental health issues and their impact on the family.",2.789,/u8X6wiZpYO6tcecjqSZ53M7RyQG.jpg,2018-04-13,0,90.0,Released,You definitely can't choose your family!,The More You Ignore Me,False,7.0,11,"Comedy,","Genesius Pictures,",,"en,","GB,",1,"Thoughtful when it wants to be, heartfelt when it needs to be, and funny when it can be, 'The More You Ignore Me' is sure to leave a smile on your face, and maybe even a tear in your eye.
- Joel Kalkopf

Read Joel's full article...
https://www.maketheswitch.com.au/article/review-the-more-you-ignore-me-searching-for-joy-amidst-the-darkness,","morrissey,",27,2,"Keith English,"
바람 바람 바람,ko,False,0,/kKP7gfLw71PgSyTTX2KnBjJyqR6.jpg,,511883,tt8108278,Two couples' windy comedy movie that is more dangerous than typhoons in Jeju Islands.,2.906,/qTLFfzhvhD2rtQsSzCXwgNsMBwS.jpg,2018-04-05,0,100.0,Released,,What a Man Wants,False,8.4,12,"Comedy,","Next Entertainment World,Hive Media Corp,",,"ko,","KR,",0,,,8,17,"Lee Byeong-heon,"
Behemoth - Messe Noire: Live Satanist,en,False,0,/7bpxnQyZeX4ZRll2oIJRolITtuv.jpg,,562516,,"Behemoth performs their 2014 album ""The Satanist"" live in Warsaw, Poland.",1.983,/lWUdKIOSaugl7RfbdTHCUDwzAAE.jpg,2018-04-13,0,184.0,Released,I Believe in Satan,Behemoth - Messe Noire: Live Satanist,False,7.0,1,"Music,Documentary,",,,,,0,,"concert,metal,behemoth,death metal,black metal,",4,0,"Lee Byeong-heon,"
Call Her Ganda,en,False,0,/71Sl4LG14gALAblXdvgguaOwVGx.jpg,http://www.callherganda.com/,512761,tt7288562,"Grassroots activists in the Philippines are spurred into action when a local transgender woman is found dead in a motel room with a 19-year-old U.S. marine as the leading suspect. As they demand answers and a just trial, hidden histories of U.S. colonization come bubbling to the surface.",3.161,/rpjN2aGkVH4Lp5NuK1CO49JUV0V.jpg,2018-04-19,0,93.0,Released,How one life galvanized a nation,Call Her Ganda,False,6.3,7,"Documentary,Crime,","Breaking Glass Pictures,Unraval Pictures,Just Films,Naked Edge Films,Sundance Institute Documentary Fund,",,"en,tl,","PH,",0,,"philippines,transgender,death,u.s. marine,",5,8,"PJ Raval,"
Fergie Vs Wenger: The Feud,en,False,0,/hIfZRKGAIeH7sA3gbvQ7T2wNWFZ.jpg,,520229,,"The rivalry between Sir Alex Ferguson and Arsene Wenger remains famous for being one of the fiercest in the history of British football. It was the feud between two titans of the sport which defined the Premier League era. Including revealing interviews from former players Paul Scholes, Philip Neville, Sol Campbell, Martin Keown and Andrew Cole.",3.48,/4idsTx8tSwcolL46bspdGJaNsm6.jpg,2018-04-23,0,65.0,Released,,Fergie Vs Wenger: The Feud,False,8.0,1,"Documentary,","Whisper Films,Channel 5,",,"en,","GB,",0,,,18,3,"Chris Grubb,"
Save This Dance,en,False,0,/7WfUCeqYBIoCNVXaB6FXkwkT2sI.jpg,,518737,tt6862864,Former high school sweethearts reluctantly reunite for a dance competition and attempt to save the small town's failing dance studio.,2.865,/cTnyS2MGsnZ0eLsfrv9szXiedB0.jpg,2018-04-19,0,81.0,Released,,Another Tango,False,6.1,9,"Drama,Romance,",,,"en,",,0,,,10,10,"Sean Michael Beyer,"
The Turpin 13: Family Secrets Exposed,en,False,0,/5urAweefIGcVqvXXrMp5N5v7B6f.jpg,,518445,,"The Turpin 13: Family Secrets Exposed. Hosted and executive produced by Emmy® and Peabody Award winning journalist Soledad O’Brien, the special will take viewers on a deep dive into the story surrounding the Turpin family and the parents, David and Louise, who have been charged with keeping their children shackled and starved within the four walls of their own Perris, California home.",3.477,/jp95487WfiQBumZgzrkP0wg0dzY.jpg,2018-04-24,0,120.0,Released,,The Turpin 13: Family Secrets Exposed,False,10.0,1,"Documentary,","Oxygen Media,",,,"US,",0,,"special,",1,0,"Sean Michael Beyer,"
GI Jews: Jewish Americans in World War II,en,False,0,/wNyjpqENmHoLwFog7ix5tFhNTV6.jpg,http://www.gijewsfilm.com/,517628,tt7474658,"GI Jews: Jewish Americans in World War II tells the story of the 550,000 Jewish American men and women who fought in World War II. In their own words, veterans both famous and unknown (from Hollywood director Mel Brooks to former Secretary of State Henry Kissinger) bring their war experiences to life: how they fought for for their nation and their people, struggled with anti-Semitism within their ranks, and emerged transformed, more powerfully American and more deeply Jewish.",2.86,/9FPTcZAvZZnxYtNzloiJFn2uXFV.jpg,2018-04-09,0,90.0,Released,,GI Jews: Jewish Americans in World War II,False,0.0,0,"Documentary,","Public Broadcasting Service,",,"en,","US,",0,,"world war ii,american g.i.,",1,4,"Lisa Ades,"
2018 Rock and Roll Hall of Fame Induction Ceremony,en,False,0,,http://info.rockhall.com/rh18,526831,tt8271982,"Recorded live, this special honors fivenew performer category inductees: Bon Jovi, The Cars, Nina Simone, The Moody Blues and Dire Straits.",3.192,/cOxxN0144ICCZig3qTfkzTRh2Lq.jpg,2018-04-14,0,173.0,Released,,2018 Rock and Roll Hall of Fame Induction Ceremony,False,0.0,0,"History,Music,TV Movie,",,,,"US,",0,,"rock 'n' roll,awards show,hall of fame,21st century,",26,0,"Lisa Ades,"
Fly on the Wall,en,False,0,,,499953,tt5086308,"A young man uses a bug camera to spy on his ex-girlfriend, then witnesses her abduction.",2.06,/qPtQPxj7xEfa5PpZxti05PCchO5.jpg,2018-04-03,0,89.0,Released,Always Be Watching,Fly on the Wall,False,2.9,4,,,,,,1,"It's inherent within the story that the camera-quality be as crap as it is, but what is not requisite within _Fly on the Wall_ is how **terrible** the acting is. 

_Final rating:★ - Of no value. Avoid at all costs._,",,6,2,"Michael R. Morris,"
At The Door,en,False,0,,,531678,tt10515340,"A strange disease is plaguing the city. Hoping to escape contamination, Eva and Sam, an estranged married couple, are forced to barricade themselves in their apartment despite the palpable tension between them. Now forced into isolation in their small living space, they struggle with their own frailty in a world that can only offer the worst horrors imaginable.",2.817,/j43961n8sLnYPJxvpy9SoVoGBjH.jpg,2018-04-24,0,99.0,Released,,At The Door,False,6.5,2,"Horror,",,,"en,","US,",0,,,3,1,"Maude Michaud,"
A Doggone Adventure,en,False,0,/tffNLDEjXv1hZIgjPb3xPTnZhCD.jpg,http://www.defiant-ent.com/product/doggone-adventure-a/,515574,tt6912990,A telepathic dog enlists a group of fun loving kids to help him solve a mystery. The K-9 detective leads the children down a road filled with action and adventure.,2.789,/ZhzUi5pt9EOMH26p3n5W1FDTBi.jpg,2018-04-04,0,85.0,Released,"In This Universe, Anything is Paw-ssible!",A Doggone Adventure,False,10.0,1,"Family,Adventure,","Defiant Screen,",A Doggone Collection,"en,","US,",0,,,7,8,"Tony Randel,"
나를 기억해,ko,False,0,/bb4zyqS2Lzzc9dpsJgsljawEUAV.jpg,,490176,tt8134688,A mystery crime thriller about a man who calls himself Master and sends mysterious texts with images of young women that they don't remember taking. A teacher and a former detective become involved in the escalating series of crimes.,2.785,/1t9olH9vux5u8Cx0bQOrl9blJrc.jpg,2018-04-19,0,116.0,Released,Drink up. Now you're my plaything.,Marionette,False,8.2,14,"Thriller,","Kidari ENT,",,"ko,","KR,",0,,,11,9,"Lee Han-uk,"
Spielmacher,de,False,0,/pNHxK7wH8wsITC2ek7oyt3xqSgS.jpg,,513211,tt7231560,"Ivo is a former pro footballer and jailbird with nothing to lose. He is a betting natural and his talent and background attract the interest of Dejan, the leader of a dangerous underworld family.",2.374,/k0ij0ahAG1uJl6C40ZqzjKqAe3z.jpg,2018-04-12,0,99.0,Released,,Playmaker,False,5.6,15,"Crime,Drama,","Frisbeefilms,Warner Bros. Deutschland,Cine Plus Filmproduktion,",,"de,",,0,,,11,2,"Timon Modersohn,"
Delinquent,en,False,0,/wLkGWNaaLmWoTx24ZzEB0h2OViW.jpg,http://indiecanent.com/movies/delinquent/,548899,tt5200232,"A rebellious teen is sentenced to serve time on his uncle's organic farm, only to learn that there's much more to the farm than meets the eye.",3.786,/1ANtdyxa9ralMe0CNg45LNFXeMW.jpg,2018-04-19,0,97.0,Released,,Delinquent,False,9.0,4,"Crime,Drama,","Streamline Pictures,",,"en,","CA,",0,,,16,2,"David I. Strasser,"
Land,en,False,0,,,500815,tt3960820,"The Yellow Eagle family are Native American and live on the Prairie Wolf Indian Reservation. News reaches them that Floyd, the youngest son of the family, has died during military service in Afghanistan. The waiting begins to get his body back to the Reservation to be buried.",2.703,/nSB2A5O2toAYMDqwe8EmLqcS9VG.jpg,2018-04-25,0,111.0,Released,,Land,False,5.1,7,"Drama,",,,"en,","FR,IT,",0,,"family relationships,death,native american reservation,",5,10,"Babak Jalali,"
Slave to the Grind,en,False,0,/zjZ8HNUu7QtzQfWYODopd6WxC03.jpg,https://www.grindcorefilm.com/,445705,tt7954282,"Grindcore is the worlds fastest most aggressively intense music. Fusing the anarchistic and leftist attitudes of the UK Punk scene with the speed and drunken aggression of American Death Metal, Grindcore continues to challenge and offend most listeners.",2.699,/wSuenjJ4im4yPokhtX8mEtPNc9N.jpg,2018-04-21,0,100.0,Released,,Slave to the Grind,False,7.4,4,"Music,Documentary,","Death By Digital Productions,",,"en,","CA,",0,,"music,death metal,grindcore,",31,6,"Doug Robert Brown,"
Who's Jenna...?,en,False,0,/zU416zT4GKgeFeU2XebHxuSZQXI.jpg,,521441,tt4317858,What could be a simple love story for Jonathan and Jenna turns out to be mayhem. Jonathan's best friend Andy wants to prove that Jenna looks like an adult film star and his boss is black-mailing him who turns out to be Jenna's brother-in-law.,2.673,/qGTTIdZxKN5nqPXka0vjY7U6vRB.jpg,2018-04-17,0,95.0,Released,,Who's Jenna...?,False,0.0,0,"Comedy,","624 Productions,Willowcreek Entertainment,",,"en,","US,",0,,"porn actor,lawyer,financial advisor,",7,1,"Thomas Baldinger,"
Fiance Killer,en,False,0,,,546763,tt7597454,"Nicole is stunned when her daughter Cameron returns from a vacation in Mexico engaged to handsome Brent. But Brent has a secret girlfriend, Lexi, and together they're planning to kill Cameron for her money right after her honeymoon.",3.26,/xgC7X5Ah35Lfs5Dbbx5gB0jUYd9.jpg,2018-04-28,0,82.0,Released,,Fiance Killer,False,5.7,3,"Crime,Thriller,TV Movie,","DeInstitutionalized,",,"en,","US,",0,,,9,14,"Fred Olen Ray,"
Larry Grayson: Shut That Door!,en,False,0,,,544929,tt8239804,"Documentary about the life of Larry Grayson, the English comedian and television presenter who was best known in the 1970s and early '80s.",2.674,/bsUqxJgiQp5WC7V6YQqEHxecw2m.jpg,2018-04-01,0,90.0,Released,"Ooh, shut that door!",Larry Grayson: Shut That Door!,False,2.0,1,"Documentary,","Double Yellow,",,"en,","GB,",0,,,6,4,"Ian Denyer,"
White Tide: The Legend of Culebra,en,False,0,,,509903,,"Rodney is an American dreamer. His glass is not only half full, but it's half full of the finest wine you've ever tasted. But when the great recession wipes out his construction business in Central Florida, his family faces a nightmare of debt. One evening around a campfire, Rodney hears a story from an old, bare-footed hippy that just might solve his family's problems. There's an island. There's a map. And there's buried treasure...$2 million dollars just waiting for someone to dig it up. Rodney is hooked. But there's just one slight, itty-bitty problem...he doesn't have a shovel. Oh, and the $2 million dollars just happens to be in cocaine form.",2.661,/r1RYFUYVLVs34nWIfIUIwnS3l4u.jpg,2018-04-20,0,83.0,Released,,White Tide: The Legend of Culebra,False,7.0,1,"Documentary,","Sidestilt,",,"en,",,0,,"treasure,map,island,",17,3,"Theo Love,"
Sudsy Slim Rides Again,en,False,0,/tJQbHmAjMMwxI3A0NJvBXHoVEHT.jpg,http://www.sudsyslim.com,507539,tt5941336,"Sudsy Slim Rides Again is a spaghetti Northwestern comedy, action, heist film about the tale of a small Alaskan town by the name of Scratcher Pass. Unfortunately, Scratcher Pass’ boom days as the world’s largest asbestos mining operation have long since faded.  The only thing keeping this little community alive is the feeble tourist industry. The main attraction? Scratcher Pass’ most famous resident, the 100 year old corpse of conman, Sudsy Slim. However, when two escaped prisoners stumble into town, Sudsy mysteriously ends up missing and the townsfolk panic. That’s when Agent Dudley Sherman of the Alaska Bureau of Criminal Detection is reluctantly dragged in to investigate.",2.652,/pM8yxiK1Mw57BmJArYK03YOuJCw.jpg,2018-04-20,0,119.0,Released,A dead guy has an adventure of a lifetime,Sudsy Slim Rides Again,False,0.0,0,"Action,Comedy,Western,",,,"en,","US,",0,,"sudsy slim,tundra comic strip,",4,3,"G. Logan Dellinger,"
#Roxy,en,False,1000000,,,490488,tt5646082,"Cyrus Nollen, Bergerac High's resident big-nosed hacker, uses social media to help a handsome star athlete win the heart of his best friend Roxy, despite the fact that he is deeply in love with her himself.",2.633,/S8hlezAkxxQHLd1EBdho9EfxL7.jpg,2018-04-13,0,100.0,Released,"To Get the Girl, Sometimes All You Need is a Nose for Confidence",#Roxy,False,4.6,5,"Comedy,Romance,","Mosaic Entertainment,",,"en,","CA,",0,,"sports,romance,",6,3,"Michael Kennedy,"
Dave Allen at Peace,en,False,0,/1lYA6oW1FJuYPBieS0tzf0fM15V.jpg,,515169,tt7912316,"Filmed in homage to his original TV series, this factual drama follows Dave Allen from childhood to becoming one of the UK and Ireland's comedy greats, with just a whiskey, a cigarette and nine-and-a-half fingers. Dave Allen is played by Aidan Gillen",2.631,/nYAwuc0DYx2T1mJXclF9uINbHZz.jpg,2018-04-02,0,60.0,Released,,Dave Allen at Peace,False,4.3,16,"TV Movie,Drama,Comedy,","DSP,BBC,",,"en,","IE,GB,",0,,,25,2,"Andy De Emmony,"
Sergio & Serguéi,es,False,0,/bx0BjtbdxAZZA5e4fuG7imyPsk2.jpg,http://www.sergioandsergeifilm.com/en/,473352,tt6131208,"In 1991, the USSR is falling apart and Cuba enters its hardest economic crisis. Sergio, a professor of Marxism who can't provide for his family, and Sergei, a Soviet cosmonaut stranded in the Mir space station, share a common passion: amateur radio. Through this hobby, both men will be able to help each other in facing the dramatic changes of their countries.",2.619,/lJQl4BIbNSnLoHJkIjVxbHN5Ubg.jpg,2018-04-20,0,90.0,Released,,Sergio and Sergei,False,5.7,19,"Drama,","ICAIC,Mediapro,RTV Comercial,Wing and a Prayer Pictures,",,"en,ru,es,","CU,ES,",0,,"cuba,soviet union,marxism,stranded,space station,radio operator,economic crisis,cosmonaut,amateur radio,father daughter relationship,",16,11,"Ernesto Daranas,"
Party Bus To Hell,en,False,0,/4M1sacd63AoDUob1S7q3T81OUDr.jpg,,508404,tt6360872,"When a party bus on its way to Burning Man filled with a bunch of sexy young adults breaks down in the desert and in the middle of a group of Satanic worshippers, all hell literally breaks loose. A massacre leaves seven survivors trapped on the bus, fighting for their lives while wondering if someone or someones are not what they seem.",3.63,/sFTfYUE7lSK7rwTvrM9DGu3utU6.jpg,2018-04-13,0,81.0,Released,,Party Bus To Hell,False,4.8,22,"Horror,Comedy,","Mahal Empire,",,"en,",,1,"***Fun small-budget horror in the Nevada desert, but trashy and one-dimensional*** 

A Las Vegas bus full of partyers travels though Nevada to the Burning Man Festival when they get stuck in the desert and a diabolical cult attacks. Tara Reid has a small part in the opening act.

“Party Bus to Hell” (2017) has the same basic plot as the even lower-budget “The Craving” (2008), but exchanges the deadly creature for the evil cult, not to mention “The Craving” is serious horror while “Party Bus” is decidedly horror comedy. The desert locations, satanic cultists and goofy-costumes also bring to mind “Race with the Devil” (1975) and “The Road Warrior” (1981) (“Mad Max” is even mentioned in the movie). But it’s by far the least of these with “The Craving” being the best of the lot despite its spare change budget (don’t get me wrong, “The Road Warrior” is definitely worthy and “Race with the Devil” has its points of interest).

The best things about “Party Bus” are the spectacular desert locations, quality soundtrack with some great metal and the amusing, kinetic tone. The inevitable creature looks quite wicked as well. But it’s all diminished by wallowing in a filthy spirit that borders on porn, hampered by sub-par women, except for one or two. Another flaw is the one-dimensional nature of the bulk of the film: A group confined in a bus with ee-vil people attacking outside. It gets dull after a while. The awful “Vampegeddon” (2010) is another micro-budget comparison, but “Party Bus” is significantly better.        

The movie runs 1 hour, 21 minutes and was shot in Nevada.

GRADE: D+,",,12,11,"Rolfe Kanefsky,"
아내와 제자들:네토라레,ko,False,0,/61Pv6KrHDvkCFv00ZudjO5vBKWw.jpg,,554462,,A married couple carry out various sexual fetishes.,2.592,/mnZyYH9hteHlcyMN8PDaRuDWJ0p.jpg,2018-04-20,0,71.0,Released,,The Wife and Her Students: Netorare,False,10.0,1,"Drama,Romance,",,,"ko,",,0,,,5,1,"No Hyun-jin,"
Every Act of Life,en,False,0,/AoRZkszhOFnlG25OV4IySXHaAF6.jpg,https://everyactoflifedocumentary.com,513146,tt6259198,"The life of Tony-winning playwright Terrence McNally (Master Class, Ragtime): 60 years of groundbreaking plays and musicals, the struggle for gay rights, addiction and recovery, finding true love, and the relentless pursuit of inspiration.",2.585,/lhVFkF82nXMWqra0amDLpWNIfEm.jpg,2018-04-23,0,93.0,Released,A groundbreaking life in and out of the theatre,Every Act of Life,False,7.7,6,"Documentary,","Floating World Pictures,",,"en,",,0,,"biography,",39,20,"Jeffrey Kaufman,"
Y Abrázame,es,False,0,/ygsDSCtDlLE2S5jP1pZ4MaZbK7i.jpg,,517154,,"Joaquin likes to hang around with friends, smoke pot and watch films. One night, Josefine stays with him and they have sex. The next day she is gone, leaving blood in the bathtub. After that, strange things start to happen to Joaquin. A fortune teller tells him the shocking truth. A daring, scary and disorienting debut with a fresh voice and a stoner sense of humour.",2.654,/d9LGv3p2xTYVbmfblaqBQBr9gC2.jpg,2018-04-14,0,63.0,Released,,Embrace Me,False,0.0,0,"Thriller,Horror,",,,"es,","AR,",0,,,3,1,"Javier Rao,"
Tramposos con suerte,es,False,0,/jT1cWL5Ys96NC83q8RCQyx5iMf3.jpg,,519881,tt8323980,A group of actors posing as others provide social recognition to its customers in order to obtain financial gain.,2.701,/bECYhCBJJeQzTXMfHD97GA4C1qC.jpg,2018-04-20,0,90.0,Released,,Tramposos con suerte,False,6.4,10,"Comedy,",,,"es,",,0,,,5,2,"Joel Núñez,"
