original_title,original_language,adult,budget,backdrop_path,homepage,id,imdb_id,overview,popularity,poster_path,release_date,revenue,runtime,status,tagline,title,video,vote_average,vote_count,genre,production_companies,belongs_to_collection,spoken_languages,production_countries,review_count,review_content,keywords,cast_size,crew_size,director
Love-40,en,False,0,,,521740,tt8150074,A friendly tennis match between Alice and Andy takes an abrupt turn when Alice goes to retrieve a stray tennis ball and is bitten by a rattlesnake.,0.611,/mdKJN2uU3HWXJjvRUBkYjclBiz7.jpg,2018-04-21,0,8.0,Released,,Love-40,False,0.0,0,,,,"en,",,0,,,4,2,"Harry Israelson,"
The Run,en,False,0,,http://therunfilm.com.au/,514393,,"The Run is a feature length documentary film which follows Australian Pat Farmer’s test of human spirit and behind the scenes drama as he runs the length of India – 80 kilometres a day for 64 days with the backdrop of colourful, enchanting, challenging, organized chaos of India, which will saturate your senses.",0.6,/l6XxzIGJiUtD98thsbbgu2GiaRD.jpg,2018-04-01,0,103.0,Released,"""It's not about the destination but all about the journey.""",The Run,False,0.0,0,"Documentary,",,,,"AU,IN,",1,"""[More] than a triumphant tale of mind-over-muscle sporting achievement; Sharma has crafted a fascinating and moving study in group dynamics, shared goals and, most importantly, the unifying goodness of the human spirit...""

Read the full review here: http://screen-space.squarespace.com/reviews/2018/3/30/the-run.html,","running,charity,marathon,india,",6,6,"Anupam Sharma,"
So You Like the Neighborhood,en,False,0,,,684628,tt7115040,"When a girl finds out she is being evicted from her Brooklyn apartment, she elicits the help of some gangsters. A dark comedy and true story starring Sarah Stiles.",0.611,/15Vf5G3CitMGgEEyYBykrgPao81.jpg,2018-04-21,0,17.0,Released,,So You Like the Neighborhood,False,0.0,0,"Comedy,Crime,",,,"en,","US,",0,,"dark comedy,organized crime,short,",18,14,"Jean Pesce,"
For Our Lives: Parkland,en,False,0,/ko8xVZn8lIf8y1i0WN8xcgR4Hpy.jpg,,521938,,"Since the deadly shooting at Marjory Stoneman Douglas High School, ABC News: Nightline producers have been on the ground in Parkland, Florida, capturing intimate moments as a community rebuilds. For Our Lives: Parkland is hosted by Elaine Welteroth, who was on the ground for ""March For Our Lives,"" to meet the students on their biggest stage yet.",0.86,,2018-04-30,0,50.0,Released,,For Our Lives: Parkland,False,0.0,0,"Documentary,",,,,,0,,"politics,school shooting,",9,0,"Jean Pesce,"
Ready For Love,en,False,0,,,582615,,Amber Lynn Weatherbee knows that the right man is out there. Maybe he's on The Bachelor?,0.61,/7nTjH6GJrP8Pf2OeOpF0vSSMOuC.jpg,2018-04-30,0,15.0,Released,,Ready For Love,False,0.0,0,,,,"en,",,0,,,5,3,"Dylan Pasture,"
Hinterland,en,False,0,,,537551,tt7946314,"Sarah, newly pregnant, is home alone after her beloved Ash leaves the country to visit family. Before long, dread and paranoia creep up on Sarah as she awaits a call from Ash, and something insidious begins to follow her body and mind.",0.61,/3q1D08VqXT3zh01tajCSFvRHML6.jpg,2018-04-29,0,23.0,Released,Sarah isn't home alone.,Hinterland,False,0.0,0,"Horror,Thriller,",,,,"US,",0,,,4,2,"Nicole Lehrman,"
Max Topas - Das Buch der Kristallkinder,de,False,536000,,https://www.wfilm.de/max-topas-das-buch-der-kristallkinder/inhalt/,527329,tt6244826,"Nine-year-old Max Topas wakes up much too late one morning and finds that his parents and sister have vanished without a trace. Monsieur Quidam, a peculiar stranger, appears just at that ...",0.6,/9kf82CAGWhlX62kEqTyfNjx6336.jpg,2018-04-29,0,86.0,Released,,Max Topas: The Book of the Crystal Children,False,0.0,0,"Fantasy,",,,"de,",,0,,,8,1,"Michael W. Driesch,"
Mies On Scene. Barcelona in two acts,en,False,0,,http://www.miesonscene.com/,526758,,"The Barcelona Pavilion, the masterpiece with which Mies van der Rohe and Lilly Reich staged their revolutionary ideas in 1929, changed the History of architecture forever. It only existed for eight months but paradoxically its image was always alive in the minds of generations of architects around the world, becoming one of his greatest influences.  The Pavilion is still surrounded by myths and mysteries that this documentary addresses, framing the building into a portrait in two acts of the Barcelona that made possible its cons-truction in 1929 and its reconstruction in 1986. We immerse ourselves in a reflection on the transformative capacity of art, the emotional perception of space and the concept of master-piece.",0.609,/aOJt0rKV5XqVTWf0EfI8QzrMJ6o.jpg,2018-04-19,0,58.0,Released,,Mies On Scene. Barcelona in two acts,False,0.0,0,"Documentary,","Nihao Films,Fundació Mies van der Rohe,",,"de,es,en,ca,","ES,",0,,,0,18,"Xavi Campreciós,"
Bloody Hell,en,False,6973,/bJbklWWCZ34ovziQnpVh3oRc3kq.jpg,,520738,tt7451664,"When Camille wakes up on the morning of her 16th birthday the world seems to have changed over night. Nothing makes sense and everything sucks. While impatiently waiting to finally start her first period, she's challenged with the emotional stages of PMS to begin her transition into womanhood.",0.6,/anEMPjIq7awPf9XEt9k5wO1WPNt.jpg,2018-04-25,0,8.0,Released,,Bloody Hell,False,0.0,0,"Drama,",,,"en,","GB,",0,,"short,",1,20,"Katharina Hingst,"
Cholet. The work of Freddy Mammani,es,False,1,,,489641,,"Is it kitsch or authentic? A wonder is unfolding at an altitude above 4000 metres in the Bolivian boomtown of El Alto. For the past fifteen years, self-made architect Freddy Mamani has been building his Cholets here. With their hallucinating colours and unruly baroque forms, the buildings are striking jewels in a predominantly drab landscape.He has already completed more than sixty of them, and the phenomenon is grabbing the attention of people all over the world. Are these nothing more than exotic extravagances, or is this authentic architecture related to the Andean architecture of the Aymara people who have lived on the plateaus of Bolivia for centuries? Off to Bolivia to meet the ‘Gaudi of the Andes’!",0.609,/cgVNvFAm0r4ViMQkf4sIcRPbS3K.jpg,2018-04-14,0,64.0,Released,Off to Bolivia to meet the ‘Gaudi of the Andes’,Cholet. The work of Freddy Mammani,False,0.0,0,"Documentary,",,,"es,",,0,,,1,2,"Isaac Niemand,"
Rough Stuff,en,False,0,/m7kbpziGSaAR3nIKkQuMjhDGSDs.jpg,,741302,,"After being abandoned by his lover Derick, Charles hires a PI to find and take care of Derick's other lover.",0.608,/6YAPn4GT7zzDBiAUOj6ozCAdBWF.jpg,2018-04-14,0,15.0,Released,I love you. I'm sorry. I love you. I'm sorry.,Rough Stuff,False,0.0,0,"Mystery,Drama,Romance,","Rodiji Andover Films,",,,"US,",0,,,4,5,"Rodiji Andover,"
Le jeu de l'amour et du hasard,fr,False,0,,,715954,tt12526820,"Théâtre de la Porte Saint-Martin , Paris From 16 janvier to 28 avril 2018.  The Game of Love and Chance (French: Le Jeu de l'amour et du hasard) is a three-act romantic comedy by French playwright Marivaux. The Game of Love and Chance was first performed 23 January 1730 by the Comédie Italienne. In this play, a young woman is visited by her betrothed, whom she does not know. To get a better idea of the type of person he is, she trades places with her servant and disguises herself. However, unbeknownst to her, her fiancé has the same idea and trades places with his valet. The ""game"" pits the two false servants against the two false masters, and in the end, the couples fall in love with their appropriate counterpart.",0.6,/dgEWQsGDlmKyBFVlr2p5JWMzsdt.jpg,2018-04-28,0,118.0,Released,,The Game of Love and Chance,False,0.0,0,"Comedy,","Theatre de la porte Saint-Martin,Atelier Théâtre Actuel,La Compagnie des Indes,",,"fr,","FR,",0,,"theater play,",6,3,"Dominique Thiel,"
あゆみ,ja,False,0,/wAFK1mcO33qvtFYx5y4i4KS0ewa.jpg,,703697,,,0.608,/hrpf8qbFUH28V7DntH1NOsQvOeZ.jpg,2018-04-20,0,0.0,Released,,あゆみ,False,0.0,0,,,,"ja,",,0,,"日向坂46,",20,2,"Muck Akazawa,"
"Mother, Mother",en,False,0,,,701708,tt7161226,A mother sneaks off in the middle of the night.,0.608,/cHgdcPAdo4RwRIxUBsmo87ydk4n.jpg,2018-04-29,0,16.0,Released,,"Mother, Mother",False,0.0,0,"Comedy,",,,,,0,,,1,14,"Rodrigo Ojeda-Beck,"
The Game,it,False,0,,,691479,,"A guy on a bar is approached by the Devil himself, who wants to play with him.",0.6,,2018-04-09,0,17.0,Released,,The Game,False,0.0,0,"Drama,Thriller,Fantasy,",,,"it,","IT,",0,,,5,7,"Riccardo Riande,"
وای آمپول,fa,False,0,,,626536,,"Story of a family who manufacture syringes, but a member of this family is afraid of injection and syringes.",0.6,/ka33Kw0kG6tV4MHaWPdK8DjNv3r.jpg,2018-04-25,0,80.0,Released,,"Wow, Injection!",False,0.0,0,"Comedy,Family,",,,"fa,",,0,,,4,3,"Alireza Mahmoodzadeh,"
理想之路,zh,False,17000000,,,617922,tt6073576,"Two brothers, experts in martial arts, have to separate their paths due to a fight in which one of them is badly wounded. Years later they are reunited in a world where organized crime controls everything.",0.608,/exLyrHpp2eI0UXM3Z6XCwCA6017.jpg,2018-04-20,60622,88.0,Released,,Path to the Dream,False,0.0,0,"Action,","HWSD Productions,",,"zh,","CN,",0,,,8,1,"Ke Zhou,"
No Returns,en,False,0,,http://noreturnsfilm.com,605896,tt7320094,A teenage Chinese-American adoptee flies to China to meet her birth mother.,0.608,/pXWC1JpZMIUdw13vhmpewu7Wj3X.jpg,2018-04-21,0,,Released,,No Returns,False,0.0,0,,,,,"US,",0,,,7,2,"Youwen Ma,"
Fictional Characters,en,False,0,,http://www.feelingtodiveandotherstories.com/fictional-characters.html,604186,tt6040450,"A contemporary read out of Hansel and Gretl, discussing gender, family and social problems.",0.6,,2018-04-22,0,10.0,Released,,Fictional Characters,False,0.0,0,"Drama,Thriller,","UZ Productions,",,"nl,","BE,",0,,,5,8,"Ivana Noa,"
The 99 Names of God,en,False,0,/2RTJbKqyPbGxrDMema9mFLBMgme.jpg,https://yumnaaa.com/,585583,tt10656064,"Arab-American filmmaker Yumna Al-Arashi embraces the rhythmic rituals that have run alongside Islamic tradition throughout the centuries in this surreal and poetic short film. Piecing together old and new, Al-Rashi's dream-like imagery breathes fresh air to a subject hardly seen in positive light.",0.608,/s0AymxKdgfSl1vA2M85gdFehBJT.jpg,2018-04-21,0,5.0,Released,,The 99 Names of God,False,0.0,0,,"NOWNESS,",,"ar,en,","GB,",0,,"islam,spirituality,experimental,",0,7,"Yumna Al-Arashi,"
Queerskins: A Love Story,en,False,10000,,http://vr.queerskins.com/,563966,tt8205132,"A diary found in a box of belongings offers a devoutly Catholic mother living in rural Missouri in the early 1990's a second chance to know Sebastian, the estranged son she has lost to AIDS. In this emotionally charged immersive video experience, visitors intimately witness the tense interactions between the two grieving parents, while taking a magic realist journey down a country road, a memory lane populated with scrapbook artifacts from Sebastian's peripatetic life.",0.608,/xduLLqxxaSLCdNGj9J6cCPIoTQl.jpg,2018-04-18,0,10.0,Released,,Queerskins: A Love Story,False,0.0,0,,,,"en,","US,",0,,,3,9,"Illya Szilak,"
Domashnee Video,ru,False,0,,https://www.andreasboschmann.de/DOMASHNEE-VIDEO,559810,tt9093016,Of my parents exactly one video tape remained. I found it after almost 20 years and I realized: My sister and me never have talked about our loss. We grew up with our grandparents in a Russian-German ghetto somewhere in rural Germany. I want to know what she feels. And I want her to know what I feel.,0.608,/xFYg9t2rIwgB8LCk0PnXcOQ2GQx.jpg,2018-04-21,0,29.0,Released,,My Home Video,False,0.0,0,"Documentary,","Film University Babelsberg Konrad Wolf,",,"de,","DE,",0,,,0,10,"Andreas Boschmann,"
Benvenuto Cellini,en,False,0,/bCQJUAHCXrb1YrXHm60vkXvOIAF.jpg,https://www.operadeparis.fr/en/season-17-18/opera/benvenuto-cellini,553522,,"The Florentine sculptor and silversmith Benvenuto Cellini rapidly attained a degree of renown that went beyond the confines of Italy. Invariably embroiled in conspiracies, intrigues and quarrels, Cellini is commissioned by the Pope to cast a large sculpture of Perseus. He is loved by Teresa, but she is promised to Fieramosca, an academic artist who has not been favoured with a papal commission. Terry Gilliam’s exuberant production draws the protagonists into a delirious and joyful yet claustrophobic and megalomaniac world: a flaring up of contagious madness.",0.6,/2Laj3irQXmd2tG7CgfdMA7lzGqY.jpg,2018-04-12,0,180.0,Released,"Hector Berlioz's opera semiseria live at the Opéra Bastille, Paris on April 12th, 2018",Benvenuto Cellini,False,0.0,0,"Comedy,Drama,History,","De Nederlandse Opera,ENO: English National Opera,Opéra National de Paris,",,"fr,",,0,,"opera,",6,5,"Terry Gilliam,"
Exploitation,en,False,4000,,http://billzebubproductions.com/comedy/exploitation/,541632,tt7543138,"Melissa is a fetish model who realizes that she had taken the wrong path. Modeling was to pay for college, but it became her career. She tries to convince a director to forsake exploitation films in favor of returning to his artistic roots.",0.608,/kN68OXMl1QXGT3fEsri5dMhUce6.jpg,2018-04-24,0,,Released,,Exploitation,False,0.0,0,,,,,,0,,,0,0,"Terry Gilliam,"
무문관,ko,False,0,/iSMMUT833r4BfLFvLLzEBPxYDVj.jpg,,539600,,,0.608,/buXCpWejPcsdx5yW61Os1xa1KK4.jpg,2018-04-19,0,96.0,Released,,The Gateless Gate,False,0.0,0,"Documentary,",,,"ko,",,0,,,0,1,"Park Dae-won,"
Algo quema,es,False,0,/sn2CQNQM1Q6NkLLn6HfwIpkT9A.jpg,,538393,,"General Alfredo Ovando Candia was a decisive figure in 20 th century Bolivian history. Through old home movies and institutional footage, Mauricio Ovando goes in search of the figure (and the shadow) of his grandfather, interweaving his history and History while going after an uncomfortable truth.",0.608,/a3c4Iu6DfrAh2HyWOQJ1nImkLdk.jpg,2018-04-17,0,77.0,Released,,Still Burn,False,0.0,0,"Documentary,","Artes Andes Américas,Nicobis,",,"es,","BO,",0,,"bolivia,bafici,alfredo ovando candía,",0,1,"Mauricio Alfredo Ovando,"
Stormtroopers,en,False,0,,,535856,tt7936324,A platoon of Stormtroopers raid a remote Rebel mining outpost.,0.6,/l6E5SD4rzPZhir7tOQ9sLNiB9Rd.jpg,2018-04-14,0,15.0,Released,,Stormtroopers,False,0.0,0,,,,,,0,,,0,1,"Micheal Fitzgerald,"
PWG: All Star Weekend 14 - Night Two,en,False,0,/6r2onqJ2S7XhtnU3HbvNmEv8SXK.jpg,,534759,,"Singles Match Trevor Lee vs. Flash Morgan Webster  Singles Match Robbie Eagles vs. ""Bad Boy"" Joey Janela  Singles Match Sammy Guevara vs. Taiji Ishimori  Pro Wrestling Guerrilla World Tag Team Championship Title Match The Rascalz (Zachary Wentz & Dezmond Xavier - Champions) vs. Violence Unlimited (Tyler Bateman & Brody King - Challengers)  Singles Match Bandido vs. Rey Horus  Singles Match Matthew Riddle vs. Timothy Thatcher  Pro Wrestling Guerrilla World Championship Title Three-way Match Keith Lee (Champion) vs. Jonah Rock (Challenger) vs. WALTER (Challenger)",0.608,/iZiORA0XicnrH82uHtwSOiMXrgT.jpg,2018-04-21,0,0.0,Released,,PWG: All Star Weekend 14 - Night Two,False,0.0,0,,,,,,0,,,17,0,"Micheal Fitzgerald,"
PWG: All Star Weekend 14 - Night One,en,False,0,/3CxwYgqGtJ6UEGfWUT0gMYCIlFP.jpg,,534758,,"Singles Match Rey Horus vs. Trevor Lee  Singles Match Bandido vs. Taiji Ishimori  Tag Team Match Violence Unlimited (Tyler Bateman & Brody King) vs. Ringkampf (Timothy Thatcher & WALTER)  Three-Way Match Robbie Eagles vs. Sammy Guevara vs. Flash Morgan Webster  Singles Match ""Bad Boy"" Joey Janela vs. Jonah Rock  Non-Title Singles Match Keith Lee (Challenger) vs. ""Hangman"" Adam Page  Pro Wrestling Guerrilla World Tag Team Championship Title Three-way Match Chosen Bros (Jeff Cobb & Matthew Riddle - Champions) vs. The Young Bucks (Matt & Nick Jackson - Challengers) vs. The Rascalz (Zachary Wentz & Dezmond Xavier - Challengers)",0.609,/14DT8HkcsphaZihsr8w3KFD8ePY.jpg,2018-04-20,0,0.0,Released,,PWG: All Star Weekend 14 - Night One,False,0.0,0,,,,,,0,,,20,0,"Micheal Fitzgerald,"
Ev Kira Semt Bizim,tr,False,0,,,528478,tt8092932,,0.608,/jqA2vpQSpseQNjBUSx8pjspdqO2.jpg,2018-04-27,0,0.0,Released,,Ev Kira Semt Bizim,False,0.0,0,"Comedy,","BSM Studio,",,"tr,","TR,",0,,,18,3,"Mustafa Kenan Aybasti,"
Chalbaaz,bn,False,0,/57h8w07vhI6AVXeoJvlSO4nKWEy.jpg,,526476,tt6923834,A money minded youth who goes to the UK to earn big bucks and comes across a girl who had ditched her family for a boyfriend.,0.608,/j6TFQCJ3eHTjgM5PrQ3K1ES3Alu.jpg,2018-04-20,0,152.0,Released,,Chalbaaz,False,0.0,0,"Comedy,Drama,","Action Cut Entertainment,Eskay Movies,",,"bn,","BD,",0,,,2,3,"Joydip Mukherjee,"
Eyelash,en,False,0,,,521078,tt8114036,"Nothing ever went right for Ellie until, in the blink of an eye, everything did. But she should have been careful what she wished for.",0.6,/GurP8QN1js95CtAHCQZkhHgv2C.jpg,2018-04-28,0,27.0,Released,,Eyelash,False,0.0,0,"Horror,",,,,"US,",0,,,2,2,"Stephen Tramontana,"
Whispering Sands,ar,False,0,,,520843,tt6118442,"A Canadian woman of Arab descent undertakes a trip and hires a guide to help her find a specific place in the Tunisian desert. To encourage her to reveal her secret, the guide tells her Sufi stories inspired by his childhood.",0.608,/h2vcuDK1paQubjXcsqx75uWoxmw.jpg,2018-04-26,0,95.0,Released,,Whispering Sands,False,0.0,0,"Drama,","Wallada Productions,",,"ar,","FR,QA,TN,",0,,,2,3,"Nacer Khemir,"
Kris Bronze,pt,False,0,,,520130,,,0.6,/8YMgExKUhjbSWafKheCjKlhqswX.jpg,2018-04-21,0,,Released,,Kris Bronze,False,0.0,0,,,,,,0,,,2,1,"Larry Machado,"
Commander Arian,ku,False,0,/yjm46CjX1zmmOAGB7xdvJL0MDEX.jpg,,519866,tt7389858,"On the front line of the Syrian war, a 30-year-old commander leads her female battalion to retake an ISIS-controlled city and emerges severely wounded, forcing her to redefine herself in this empowering tale of emancipation and freedom.",0.6,/w8usdVxpYZ07BOJfRkeXt7dDudP.jpg,2018-04-29,0,77.0,Released,"A Story of Women, War and Freedom",Commander Arian,False,0.0,0,"Documentary,","Alba Sotorra,Boekamp & Kriegsheim,",,"ku,es,","DE,ES,SY,",0,,"syria,women's rights,isis (daesh),ypj,",0,9,"Alba Sotorra,"
Black Label Pro 6: Slamilton,en,False,0,/njz557tGskZ7rUwOYFln7IxOheI.jpg,,519697,,"BLACK LABEL PRO WRESTLING PRESENTS: SLAMILTON  -FEATURING-  Black Label Pro Championship: ""Filthy"" Tom Lawlor (c) vs Nick Gage  Quebecer Pierre vs Chris Dickinson  Allie Kat vs Shazza McKenzie  General Order 24 vs Scott's Tots  Kobe Durst vs Ethan Page  Facebrooke vs Christi Jaynes  Mark Wheeler vs PB Smooth vs Tre Lamar vs Sage Philips vs Pat Monix vs Jaxon Stone  Mance Warner & AJ Gray vs #NoNewFriends  Kody Rice vs Shane Sabre  Simon Grimm vs Fred Yehi",0.608,/y5MW9563zIre2fcx7XDRoGYOEVv.jpg,2018-04-21,0,120.0,Released,,Black Label Pro 6: Slamilton,False,0.0,0,,,,,,0,,,8,0,"Alba Sotorra,"
An Artificial Reality,en,False,0,,,519694,tt8163960,"We live an illusionary existence in a world filled with lies. We remain in a perpetual state of delusion. Our perception of reality has been corrupted. Big Brother knows everything, manipulates our emotions, manipulates how we think and controls the masses. We willingly allowed it because we desired it. We have become one with the machine. It’s our ultimate nightmare, and it’s about to get much worse. We will no longer be human. This is your future, an artificial reality.",0.6,/h7pBfS6YFnF8sYFS1ssJPNIsJXv.jpg,2018-04-24,0,66.0,Released,,An Artificial Reality,False,0.0,0,"History,",,,"en,",,0,,"history,",0,1,"Philip Gardner,"
Sad! (A Love Story),en,False,0,,https://vimeo.com/264823775,519012,tt7385696,'Sad! A Love Story' is a feature currently being written by Avital Ash. It follows a happy couple whose relationship falls apart when Donald Trump becomes president.  The dramedy is as much an exploration of the lingering effects of sexual assault as it is a darkly comedic look at DUT (Dating Under Trump).  Avital Ash wrote & directed this short as a chemistry test and to prove to Amir Blumenfeld that he is also a good dramatic actor. Andrew Mueller shot and voices the 'director'.,0.6,,2018-04-15,0,7.0,Released,Donald Trump's winning the election ruins a couple's sex life.,Sad! (A Love Story),False,0.0,0,"Comedy,Drama,Romance,",,,"en,","US,",0,,"love,dating,",3,5,"Avital Ash,"
A Elipse do Tempo,pt,False,0,,,518519,,"Helena is a respected plastic artist who finds herself in personal and professional decadence. ""The Ellipse of Time"" is a real drama about the life of an artist who has her frustrated wills with degenerative disease - Alzheimer's disease and the ellipses, the present and the past. Waiting for the day your life ends up as a blank, empty screen.",0.6,,2018-04-16,0,15.0,Released,,A Elipse do Tempo,False,0.0,0,"Drama,",,,"pt,","BR,",0,,,0,2,"Luan Moreno,"
Дерево,ce,False,0,,,518484,tt7925644,"North Causacus, 1994. Hava and Adam live next door and are friends like their parents. The children write letters to each other and pass them hiding them in a tree hollow. They love the tree and confide their secrets to it. They are dreamers living in their fantasy. Aslan, Adam's farther, runs business in town and comes back to the village one day. Sultan, Hava's farther, like many other of their neighbors, is happy for his success and celebrates his coming home. Unfortunately not all of the villagers share these feelings…",0.6,/oPus4ZMQOCntV18cgaHl5cbeXzM.jpg,2018-04-19,0,22.0,Released,,The Tree,False,0.0,0,"Drama,","VGIK,",,"ce,","RU,",0,,,8,6,"Hava Mukhieva,"
Bacchus Uncovered: Ancient God of Ecstasy,en,False,0,/8vd7goVJUSzxTkqSP5igdbg4Xux.jpg,http://www.bbc.co.uk/programmes/b09z8d01,518227,tt8338622,"Professor Bettany Hughes investigates the story of Bacchus, god of wine, revelry, theatre and excess, travelling to Georgia, Jordan, Greece and Britain to discover his origins and his presence in the modern world, and explore how 'losing oneself' plays a vital role in the development of civilisation.  Bettany begins in Georgia where she discovers evidence of the world's oldest wine production, and the role it may have played in building communities. In Athens she reveals Bacchus's pivotal role in a society where his ecstatic worship was embraced by all classes, and most importantly women. On Cyprus she uncovers startling parallels between Bacchus and Christ. Finally, Bettany follows the god's modern embrace in Nietzsche's philosophy, experimental theatre and the hedonistic hippie movement to conclude that, while this god of ecstasy is worthy of contemporary reconsideration, it is vital to heed the warning of the ancients - ""MEDEN AGAN"" - nothing in excess.",0.6,/gzeKd2Ez3lASlUsMXTzcpoGbY3G.jpg,2018-04-11,0,58.0,Released,MEDEN AGAN - nothing in excess.,Bacchus Uncovered: Ancient God of Ecstasy,False,0.0,0,"Documentary,History,",,,,,0,,"bacchus,",0,0,"Hava Mukhieva,"
Open Wound - The Übermovie,en,False,0,,,518120,tt6144410,"What starts with innocent intimate shavings, ends with a bonded woman screaming rape accusations. The offender collapses and becomes the victim. Or was it all part of an ingenious plan? A game of lust, sweat and blood.",0.608,/dFpmB9SvA0fuEK6MhfqW3CBkfWW.jpg,2018-04-17,0,96.0,Released,,Open Wound - The Übermovie,False,0.0,0,,,,,"DE,",0,,,0,1,"Jürgen Weber,"
Bambi Eyes,en,False,0,,,518104,,A visual/aural essay on Lindsay Lohan and celebrity culture.,0.608,/477jj6xDcgDEG713wEyelSqIPDj.jpg,2018-04-14,0,14.0,Released,,Bambi Eyes,False,0.0,0,"Documentary,",,,,,0,,,1,1,"Douglas Reese,"
IPW:UK International Battle Royale,en,False,0,/bOAX1fSUXs80alem5Sc1g7mVy9F.jpg,,518053,,After a sell out show to end 2017 we return to the Casino Rooms for International Battle Royale feat 30 international superstars competing for a shot at the IPW World Championship!,0.608,/8z8bQzVJ24UtxfRncdb6Wj8Y0hD.jpg,2018-04-29,0,120.0,Released,,IPW:UK International Battle Royale,False,0.0,0,,,,,,0,,,3,0,"Douglas Reese,"
Moon Children,en,False,0,,,517410,,"On a tiny street live neighbours Leo (12) and Lucy (18). While Leo dreams of becoming a great magician, Lucy struggles with her first heartbreak. Both feeling rejected, they settle in for a long and lonely night. When Leo notices Lucy through his window, the night takes a magical turn. Are they as lonely as they think?",0.6,/exuV15kv11XfTzKvGqoNYktTIqF.jpg,2018-04-18,0,,Released,,Moon Children,False,0.0,0,,,,,,0,,,0,1,"Marlyn Kist de Ruijter,"
Kada dođu svinje,sr,False,0,,http://whenpigscome.com/en,516635,tt7191858,"Dragoslava has four TV sets, three grandchildren, two best friends, and a husband with whom she fights over a remote control. She keeps her private archive of memories of all major events in recent political history of five countries in which she has lived, without ever moving from her apartment. She is a trained poll monitor, passionate about her right to be in the minority, but more and more desperate as another early election approach.",0.6,/7KfBUaHyB3MrTSP8tBCfh4vkk6L.jpg,2018-04-30,0,72.0,Released,,When Pigs Come,False,0.0,0,"Documentary,","Wake Up Films,Kinematograf,Hrvatska Radiotelevizija,Al Jazeera Balkans,",,"sr,","BA,HR,RS,",0,,,7,7,"Biljana Tutorov,"
Carvana,pt,False,0,,,515485,tt9602614,"Chronicles the life and career of Hugo Carvana, brazilian actor and filmmaker.",0.608,/7v9Y71Cvdqg6GhMpj6wBjcVBRYG.jpg,2018-04-11,0,104.0,Released,,Carvana,False,0.0,0,"Documentary,",,,"pt,","BR,",0,,,1,1,"Lulu Corrêa,"
Verão em Rildas,pt,False,0,,,512815,,,0.6,/pTrfwnUY4D33aNGFummT7GpCQJx.jpg,2018-04-26,0,,Released,,Verão em Rildas,False,0.0,0,,,,,,0,,,0,1,"Daniel Caetano,"
Lado B,es,False,0,/5PuD8CmzPNY9ZQGJCQbwexfzWxd.jpg,http://www.promofest.org/films/lado-b,510310,tt8045446,Jacquelín is a forty year old single mother who decides to leave everything behind.,0.608,/yQTvgi9iubwC4wqAIm6BRp13yOc.jpg,2018-04-13,0,75.0,Released,,Side B,False,0.0,0,"Documentary,Drama,",,,"es,","CL,",0,,"biography,snow,single mother,real story,",2,12,"Ricardo Yebra,"
